{
  "bundle_kind": "capability-disposition:deployment-admission:v1",
  "entries": [
    {
      "digest": "sha256:a13482ea50a3d07d966c8aadf99af69bd9225549d792e1f4eaa39da24d804ab8",
      "logical_name": "capability-disposition-subject-ce-source-artifact",
      "media_type": "application/json",
      "relative_path": "pmorg/capabilities/dispositions/subject-ce-source-artifact-v1.json",
      "size_bytes": 893
    },
    {
      "digest": "sha256:1bc2c22639e5e1e22920673bb5f4423b59bda6ab05732cb3c1300499db7b6693",
      "logical_name": "capability-catalog",
      "media_type": "application/json",
      "relative_path": "pmorg/capabilities/capability-catalog-v1.json",
      "size_bytes": 4415
    },
    {
      "digest": "sha256:a61efd6f39d5c4e12f3f1ee16a73f654ed1cb29b19048bafa060dce1df14a548",
      "logical_name": "deployment-admission-candidate-search-evidence",
      "media_type": "application/json",
      "relative_path": "pmorg/capabilities/candidate-search/deployment-admission-search-evidence-v1.json",
      "size_bytes": 11668
    },
    {
      "digest": "sha256:0325c4c5498a70aea2ce74bfdd2784784d9f1acd9b6f7b535fa5bce9969d669c",
      "logical_name": "candidate-qualification-report-index",
      "media_type": "application/json",
      "relative_path": "pmorg/capabilities/candidate-qualification-reports-v1.json",
      "size_bytes": 256440
    },
    {
      "digest": "sha256:c2b38991bb0acca9cc6249f7484a577a0f712dbda3087dbbcdb24684a5d51114",
      "logical_name": "post-disposition-qualification-index",
      "media_type": "application/json",
      "relative_path": "pmorg/capabilities/post-disposition-qualification-v1.json",
      "size_bytes": 7704
    },
    {
      "digest": "sha256:cac54add41bb38c1421266500e181dd5e51ab41f7d78aab83bd027cec4dd6340",
      "logical_name": "deployment-admission-post-disposition-qualification-report",
      "media_type": "application/json",
      "relative_path": "pmorg/capabilities/post-disposition-qualification-reports/deployment-admission.json",
      "size_bytes": 5902
    },
    {
      "digest": "sha256:80fbe560695cc1c15500f66c05eeeab9ecc363005fff41e15ff31eaa934655b8",
      "logical_name": "deployment-admission-backend__pmorg__application__admission.py.json-snapshot",
      "media_type": "application/json",
      "relative_path": "pmorg/capabilities/dispositions/implementation-snapshots/deployment-admission/backend__pmorg__application__admission.py.json",
      "size_bytes": 479
    },
    {
      "digest": "sha256:1152059995519b5c4ebf749baed892890fcbe57fabb776b38ce3b40163dd9689",
      "logical_name": "deployment-admission-backend__pmorg__application__qualification.py.json-snapshot",
      "media_type": "application/json",
      "relative_path": "pmorg/capabilities/dispositions/implementation-snapshots/deployment-admission/backend__pmorg__application__qualification.py.json",
      "size_bytes": 483
    },
    {
      "digest": "sha256:6665b6d7dc3027913c5f4bcff49e6c072a66c7b4fd896807cd110f27ef656c57",
      "logical_name": "deployment-admission-backend__pmorg__application__rbdp.py.json-snapshot",
      "media_type": "application/json",
      "relative_path": "pmorg/capabilities/dispositions/implementation-snapshots/deployment-admission/backend__pmorg__application__rbdp.py.json",
      "size_bytes": 474
    },
    {
      "digest": "sha256:d322338486e01334b3719cb1d526f0b03d544ebf3baec504051f64572795f848",
      "logical_name": "deployment-admission-backend__pmorg__contracts__types.py.json-snapshot",
      "media_type": "application/json",
      "relative_path": "pmorg/capabilities/dispositions/implementation-snapshots/deployment-admission/backend__pmorg__contracts__types.py.json",
      "size_bytes": 473
    },
    {
      "digest": "sha256:6496b369b79fa22948373d68522896c37cb3e5899d3f0a27c1a527c272e780b3",
      "logical_name": "candidate-0f2788cbd00dabcc371db39a8ec598feb5da3a306f5f259c8e817bd15bf835ef-qualification-report",
      "media_type": "application/json",
      "relative_path": "pmorg/capabilities/candidate-qualification-reports/deployment-admission/candidate-0f2788cbd00dabcc371db39a8ec598feb5da3a306f5f259c8e817bd15bf835ef.json",
      "size_bytes": 2755
    },
    {
      "digest": "sha256:056167e3bdcdcd6719167328a84b0eb3c0d32897cc92213a43c9a0574dbe9fcb",
      "logical_name": "candidate-2676724511cd12f2be82ef1dcc59dd84cbb2784b407ed18315fd327b598cbab4-qualification-report",
      "media_type": "application/json",
      "relative_path": "pmorg/capabilities/candidate-qualification-reports/deployment-admission/candidate-2676724511cd12f2be82ef1dcc59dd84cbb2784b407ed18315fd327b598cbab4.json",
      "size_bytes": 4561
    },
    {
      "digest": "sha256:762f6ef3c5c3cf7989703552c3b773833d42d545dc58f17113c0b9d0f7b7ae88",
      "logical_name": "candidate-7bbd952bdd0a87f359e7d7f923bd6200d6d58303aa21b38876379aaa8400400f-qualification-report",
      "media_type": "application/json",
      "relative_path": "pmorg/capabilities/candidate-qualification-reports/deployment-admission/candidate-7bbd952bdd0a87f359e7d7f923bd6200d6d58303aa21b38876379aaa8400400f.json",
      "size_bytes": 2758
    },
    {
      "digest": "sha256:6d66887654b2cc29b9785d1e08ad3faa7bfa4b3317fb78ff3ccaab2169806941",
      "logical_name": "candidate-c687550428252a99b135b41c51200cf0abe932a2ab9910aab1c390475c44bf4f-qualification-report",
      "media_type": "application/json",
      "relative_path": "pmorg/capabilities/candidate-qualification-reports/deployment-admission/candidate-c687550428252a99b135b41c51200cf0abe932a2ab9910aab1c390475c44bf4f.json",
      "size_bytes": 2833
    },
    {
      "digest": "sha256:2a14b30d2c60aeaab9ef2d8faf4c27eb34bf1e56a1fba8bd74a25a802decc6b5",
      "logical_name": "candidate-3d1abaeb2abb5483596b96b9af6047e30725f3da2fa0dfb4f62afce506553376-qualification-report",
      "media_type": "application/json",
      "relative_path": "pmorg/capabilities/candidate-qualification-reports/deployment-admission/candidate-3d1abaeb2abb5483596b96b9af6047e30725f3da2fa0dfb4f62afce506553376.json",
      "size_bytes": 2688
    },
    {
      "digest": "sha256:6924802be9b1d89c3197e51b2638f1c81a0d5ba66a57bca3ecd8e8ca187d99ef",
      "logical_name": "candidate-6cb08ad609262bd37a9c2445f438494db01e390f2810152f5ffebf9ec8bd4b7f-qualification-report",
      "media_type": "application/json",
      "relative_path": "pmorg/capabilities/candidate-qualification-reports/deployment-admission/candidate-6cb08ad609262bd37a9c2445f438494db01e390f2810152f5ffebf9ec8bd4b7f.json",
      "size_bytes": 2694
    },
    {
      "digest": "sha256:6f54820825fc28acfe5c3c7744b490f41e1e97d9fdcdb67cb5935d2a8350f381",
      "logical_name": "candidate-2d5d732350b0dec64d45689232ccf11ac3c37a930b6f3783bb385d8f843de070-qualification-report",
      "media_type": "application/json",
      "relative_path": "pmorg/capabilities/candidate-qualification-reports/deployment-admission/candidate-2d5d732350b0dec64d45689232ccf11ac3c37a930b6f3783bb385d8f843de070.json",
      "size_bytes": 2943
    },
    {
      "digest": "sha256:b3321a683315a5b7a4f1720713eb781fabc8f1c8780884f1fabd7f247d547089",
      "logical_name": "candidate-726bcf4a4851582c2ad97ceb8141a0e0cfaafdfc68dc1b724fe97871a7aef8a8-qualification-report",
      "media_type": "application/json",
      "relative_path": "pmorg/capabilities/candidate-qualification-reports/deployment-admission/candidate-726bcf4a4851582c2ad97ceb8141a0e0cfaafdfc68dc1b724fe97871a7aef8a8.json",
      "size_bytes": 32987
    },
    {
      "digest": "sha256:01b6a9daac0b08388bfca018056eb4da0cb693c763856e6548f252021e5e38b8",
      "logical_name": "candidate-d4710aa342119b56c5440f08ca9c75ecac8cf5940f619e778889cb4dd99ef01a-qualification-report",
      "media_type": "application/json",
      "relative_path": "pmorg/capabilities/candidate-qualification-reports/deployment-admission/candidate-d4710aa342119b56c5440f08ca9c75ecac8cf5940f619e778889cb4dd99ef01a.json",
      "size_bytes": 3457
    },
    {
      "digest": "sha256:4209cad5ba3d6c560a84d5a00adc8acd29787f3fc6e2762948da1bc96ffbab82",
      "logical_name": "candidate-5b2ef81045307f65b4fc505b5eff112b765612b88323a635a4dac59ec3d63324-qualification-report",
      "media_type": "application/json",
      "relative_path": "pmorg/capabilities/candidate-qualification-reports/deployment-admission/candidate-5b2ef81045307f65b4fc505b5eff112b765612b88323a635a4dac59ec3d63324.json",
      "size_bytes": 3183
    },
    {
      "digest": "sha256:7c5354fce24996d52f8c97bc5b0310d59945c99d208d7bba0dc53e812d4bd586",
      "logical_name": "candidate-c2b7077396ddf71fbbb7c36f6474e9796c4e1d15dd6f4a7ec3c7932fa18d2b04-qualification-report",
      "media_type": "application/json",
      "relative_path": "pmorg/capabilities/candidate-qualification-reports/deployment-admission/candidate-c2b7077396ddf71fbbb7c36f6474e9796c4e1d15dd6f4a7ec3c7932fa18d2b04.json",
      "size_bytes": 2805
    },
    {
      "digest": "sha256:5a7a9f689ddc6c4cb833ffa150a2bee439465c1981027ceba013c1e029c733d4",
      "logical_name": "candidate-2a15659e4319ef1b9e6504e21257bdd4fb0a2621dc733dec9349660e79fb0a81-qualification-report",
      "media_type": "application/json",
      "relative_path": "pmorg/capabilities/candidate-qualification-reports/deployment-admission/candidate-2a15659e4319ef1b9e6504e21257bdd4fb0a2621dc733dec9349660e79fb0a81.json",
      "size_bytes": 3617
    },
    {
      "digest": "sha256:03cbb69c65275764ffb922fca2df88c28cdc78e82d99728b76f6c8e8f06fdf0a",
      "logical_name": "candidate-667369856eb8b85e221d91f034946516a558ffd6d1894541c7c746094f91d541-qualification-report",
      "media_type": "application/json",
      "relative_path": "pmorg/capabilities/candidate-qualification-reports/deployment-admission/candidate-667369856eb8b85e221d91f034946516a558ffd6d1894541c7c746094f91d541.json",
      "size_bytes": 8396
    },
    {
      "digest": "sha256:b69cce3beb8b71eacb6ee9a7de61a98457655c0ba4c15345be9a10e599f2acf0",